Name,TotalTime,RecipeCategory,Keywords,RecipeIngredientParts,RecipeInstructions,Calories
Chicken Adobo,PT1H15M,Chicken Thigh & Leg,"c(""Chicken"", ""Poultry"", ""Meat"", ""Filipino"", ""Asian"", ""Very Low Carbs"", ""High Protein"", ""High In..."", ""Beginner Cook"", ""< 4 Hours"", ""Easy"", ""Inexpensive"")","c(""chicken thighs"", ""white vinegar"", ""low sodium soy sauce"", ""garlic cloves"", ""whole black peppercorns"", ""bay leaves"")","c(""Mix all ingredients together (except chicken thighs) to make marinade."", ""Place chicken thighs in a large pot or dutch oven."", ""Pour marinade over chicken, evenly coating the pieces."", ""Place in fridge for 1-3 hours."", ""Bring pot to a boil and then reduce heat."", ""Cover and let simmer for 30 minutes."", ""Uncover and let simmer until sauce is reduced and thickened, about 15-20 minutes."")",987.5
Chicken Adobo,PT1H40M,Chicken Thigh & Leg,"c(""Chicken"", ""Poultry"", ""Meat"", ""Filipino"", ""Asian"", ""Very Low Carbs"", ""< 4 Hours"")","c(""white vinegar"", ""garlic cloves"", ""bay leaf"", ""peppercorns"", ""reduced sodium soy sauce"", ""chicken legs"", ""water"", ""canola oil"", ""cilantro"")","c(""In a large glass baking dish, mix together the vinegar, garlic, bay leaf, peppercorns, and soy sauce."", ""Add the chicken and toss to coat."", ""Cover and marinate for 1 hour in the refrigerator."", ""Transfer chicken and its marinade to a large saucepan."", ""Add water and bring to a boil. Cover, reduce heat to low, and simmer 20 minutes."", ""Using tongs, transfer chicken to a plate to cool."", ""Boil cooking liquid about 10 minutes, or until reduced to 1 cup."", ""Allow sauce to cool."", ""Strain into a small saucepan. Skim off fat and reheat."", 
""Pat chicken dry with paper towels."", ""In a large skillet, heat oil over high heat until quite hot."", ""Brown chicken in batches, about 2 minutes per side."", ""Transfer to a deep platter and pour hot sauce over chicken."", ""If desired, garnish with cilantro."")",624.5
Cebuano Lumpia,PT55M,Onions,"c(""Vegetable"", ""Filipino"", ""Asian"", ""Healthy"", ""Brunch"", ""< 60 Mins"", ""Beginner Cook"", ""Deep Fried"", ""Easy"", ""Inexpensive"")","c(""lumpia skins"", ""ground pork"", ""string beans"", ""carrots"", ""garlic"", ""green peppers"")","c(""Brown ground pork and drain.  Add all ingredients diced as fine as you can and toss on low heat for 10 minutes or until vegetables are al dente.  place in a bowl and allow to cool."", ""The trick to rolling a proper lumpia is to put about a tablespoon of the meat vegetable mixture apx 1/4\"" from the bottom of the lumpia wrapper.  Flip that 1/4\"" over the top of the mix and tuck it underneath and make it tight.  Roll it like a cigar for 1 roll and then tuck in the sides like a burrito and continue rolling until the last roll.  Moisten the last 1/4\"" with water  to seal it like an envelope."", 
""Once you get to this stage you can deep fry, refrigerate, or freeze the lupia.  Regardless when you do fry them fry until the outside is very light brown and place on a plate with a paper towel to dry excess oil.  Serve with a sweet and sour sauce."")",136.5
Spicy Florvel Beef,PT1H5M,Roast Beef,"c(""Steak"", ""Meat"", ""Filipino"", ""Asian"", ""Stir Fry"", ""< 4 Hours"")","c(""beef"", ""scallions"", ""black pepper"", ""garlic cloves"", ""soy sauce"", ""brown sugar"", ""granulated sugar"")","c(""Put beef into a mixing bowl.add garlic cloves,hot teriyaki sauce,the brown and ranulated sugar,and black pepper.marinade it with in 5-10 mins.mix well."", ""add the scallions and mix well.pour 2 1/2 cups of water into the marinade beef."", ""put it in a frying pan and let it boil until tender (sauce will appear more creamy)."", ""after boiling, place marinade beef on a plate."", ""heat frying pan for stir-frying. pour vegetable oil on pan.and fry the marinade beef."", ""cook until firm."")",894.4
Filipino Adobo (Pork or Chicken) With Slow Cooker Variation,PT15M,Meat,"c(""Filipino"", ""Asian"", ""Very Low Carbs"", ""High Protein"", ""High In..."", ""< 15 Mins"", ""Easy"")","c(""pork"", ""chicken"", ""vinegar"", ""soy sauce"", ""water"", ""bay leaves"", ""peppercorns"", ""garlic cloves"", ""onion"", ""ground pepper"", ""salt"")","c(""Note: The original recipe just called for vinegar.  I use Apple Cider Vinegar - just use what you have.  Some reviewers have used rice vinegar and been pleased.  Rice vinegar seems to have a touch of sweetness.  Do what pleases you - experiment and have fun in the kitchen."", ""Stove top instructions."", ""Combine all of the ingredients in a large pot. (The women who shared the recipe with me put the spices into the pot freely.  Reviewer Felina suggested tying the spices into a cheesecloth to so that you get the flavor but don't bite into the peppercorns while you eat the dish - a stainless tea ball works too.  Do whichever please you)."", 
""Allow everything sit at room temperature for at least 15 minutes."", ""Bring to a boil then reduce heat to low; simmer for 1 1/2 - 2 hours (leave lid slightly ajar)."", ""Remove lid and cook 10 minutes more."", ""Serve with rice."", ""Slow Cooker instructions."", ""Combine all of the ingredients in a slow cooker.  (The women who shared the recipe with me put the spices into the pot freely.  Reviewer Felina suggested tying the spices into a cheesecloth to so that you get the flavor but don't bite into the peppercorns while you eat the dish - a stainless tea ball works too.  Do whichever please you)."", 
""Allow meat to sit at room temperature for at least 15 minutes."", ""Cook on high for 3 hours or on low for 6 hours until pork or chicken is done (time depends on your slow cooker)."", ""Serve with rice."", ""(Freezer instructions courtesy of Erindipity)."", ""To freeze:  Combine all ingredients in a ziptop bag.  Freeze."", ""To serve: Thaw overnight in the refridgerator.  Allow to sit at room temperature for 15 minutes; cook as directed."")",730.6
Brain Puffs,PT30M,Dessert,"c(""Pineapple"", ""Tropical Fruits"", ""Fruit"", ""Canadian"", ""Filipino"", ""Asian"", ""Healthy"", ""Kid Friendly"", ""Sweet"", ""< 30 Mins"")","c(""marshmallows"", ""peanut butter"", ""pineapple ring"", ""graham crackers"")","c(""Melt the chocolate in a saucepan, then melt marshmallows, then melt peanut butter, and mix in the rice krispies."", ""Roll into little balls (put water on hands to help prevent sticking) and put it on a pineapple triangle (of fresh pinapple or canned) on top of a graham wafer."", ""Serve immediately. Enjoy!"", ""It should look like a brain!"")",278.9
Filipino Coconut Candy,PT17M,Candy,"c(""Dessert"", ""Filipino"", ""Asian"", ""Low Protein"", ""< 30 Mins"", ""Easy"")","c(""brown sugar"", ""coconut"", ""butter"", ""milk"", ""vanilla"")","c(""melt  butter in pan"", ""add brown sugar and coconut."", ""add milk"", ""cook until  milk is gone and sugar browns"", ""add vanilla"", ""put on cookie sheet to cool."")",484.5
Crema De Fruta,PT35M,Dessert,"c(""Filipino"", ""Asian"", ""< 60 Mins"", ""Easy"")","c(""ladyfingers"", ""white sugar"", ""flour"", ""evaporated milk"", ""water"", ""unflavored gelatin"", ""water"", ""sugar"", ""lemon juice"")","c(""Custard Filling:"", ""Combine and stir constarntly sugar, flour, yolks, milk 1/2 cup water in a saucepan (waterbath when heated so it doesn't get burnt) until it  thickens and becomes creamy (about 10-15mins). Make sure there are no lumps."", ""Remove from heat and cool."", ""Gelatin glazed topping:"", ""Mix last 5 ingredients  in a saucepan, heating and mixing for 5-10mins until dissolved."", ""Remove from heat and cool."", ""To assemble:"", ""Arrange ladyfingers side by side in a single layer on top of a medium sized pyrex dish."", 
""Spread 1/2 of the  custard filling on top of  first layer making sure to even it out."", ""Arrange1/2 canned fruits on top of custard."", ""Repeat layering: ladyfingers, then custard, then fruits."", ""Pour gelatin mixture  on top of the final layer ; completely covering the fruits if possible."", ""Chill in the fridge until the gelatin is set."", ""Serve."")",866.1
Tinolang Manok (Chicken Ginger With Green Papaya),PT1H,Lunch/Snacks,"c(""Chicken Breast"", ""Chicken Thigh & Leg"", ""Chicken"", ""Poultry"", ""Meat"", ""Filipino"", ""Asian"", ""Savory"", ""< 60 Mins"", ""Easy"")","c(""roasting chickens"", ""fresh ginger"", ""garlic cloves"", ""onion"", ""salt"", ""water"", ""papayas"")","c(""In a saucepan, heat oil over medium heat.  Saute ginger, garlic and onion for 2 minutes.  Add chicken and saute until chicken colors slightly, about 10 minutes.  Season with patis and salt.  Add water and papaya; bring to a boil."", ""Lower heat andsimmer 30 minutes or until chicken and papaya are tender (unripe papaya has papain which helps tenderize meat and aids in digestion).  Add pepper leaves; taste and correct seasoning.  Cover and remove from heat.  Let stand for 5 minutes to allow pepper leaves to cook from soup's heat."", 
""Zucchini or chayote may be used instead of green papaya."")",585.9
Roast Beef  for Two,PT50M,One Dish Meal,"c(""Meat"", ""Filipino"", ""Asian"", ""Savory"", ""< 60 Mins"", ""Easy"")","c(""potatoes"", ""pepper"", ""salt"", ""onion"", ""hard-boiled eggs"", ""green onion"", ""tomatoes"")","c(""In a nonstick saucepan,heat oil over medium heat,fry potatoes,5 minutes on each side."", ""Push to one side of pan."", ""Add garlic and onions,cook with potatoes until potatoes are tender, about 10 minutes."", ""Add chopped tomato,season with salt and pepper."", ""Stir in roast beef slices and heat through."", ""Transfer to serving dish."", ""Garnish with eggs and sprinkle with green onions."")",637
Filipino Chicken Afritada,PT50M,Stew,"c(""One Dish Meal"", ""Chicken Thigh & Leg"", ""Chicken"", ""Poultry"", ""Beans"", ""Meat"", ""Filipino"", ""Asian"", ""Savory"", ""< 60 Mins"", ""Easy"")","c(""chicken"", ""potatoes"", ""carrots"", ""garlic"", ""onion"", ""salt"", ""tomatoes"", ""green peas"", ""tomato ketchup"")","c(""In a wok,heat a 2 tbsp of cooking oil.saute the garlic until a bit brown,then follow the onion."", ""wait about 10 seconds and pour in chickens,stir until golden brown.follow with potatoes and carrots;stir for about 20 seconds and then put in beans and tomatoes."", ""pour some water(enough for you to make its sauce) let it boil,and lastly pour in tomato ketchup.when the sauce become thick,turn off the heat.serve."")",548.6
Turon (Sweet Fried Banana Spring Rolls),PT20M,Dessert,"c(""Tropical Fruits"", ""Fruit"", ""Filipino"", ""Asian"", ""Vegan"", ""Sweet"", ""< 30 Mins"", ""Beginner Cook"", ""Deep Fried"", ""Easy"", ""Inexpensive"")","c(""plantains"", ""dark brown sugar"", ""cinnamon"", ""water"")","c(""place a sliced banana 1 1/2  inch from the bottom edge of a spring roll wrapper, sprinkle it with some sugar and cinnamon, and top it with a sliced jack fruit."", ""seal the sides and roll the wrapper, sealing the top as well  with  water/starch mixture."", ""In the meantime, heat oil in non-stick wok(so sugar doesn't stick) until it's sizzling hot with the leftover sugar and fry the wrapped bananas until it's golden brown,  spooning (or use spatula) the sugar from the pan on the wrapper to give it a bit  of caramelized coating."", 
""Drain on paper towels or sieve."", ""Serve while still warm and the wrapper's crunchy."")",689.8
Banana Loaf,PT1H20M,Dessert,"c(""Fruit"", ""Filipino"", ""Asian"", ""Very Low Carbs"", ""Low Protein"", ""Low Cholesterol"", ""Toddler Friendly"", ""Kid Friendly"", ""Sweet"", ""< 4 Hours"", ""Easy"", ""Inexpensive"")","c(""sugar"", ""butter"", ""eggs"", ""flour"", ""baking soda"", ""bananas"", ""ground walnuts"")","c(""Cream butter and sugar together until smooth.add eggs to creamed mixture."", ""Add flour and baking soda to butter and egg mixture,stir to blend well,add bananas and nuts and/ or raisins; combine well."", ""Pour mixture in greased and floured 9'' x 5\"" x 3\"" loaf pan.bake at 350 F for about 6o minutes or until a toothpick inserted in the middle of the loaf comes out clean.remove from pan and allow to cool before slicing."")",536.9
Chicken Adobo,PT55M,Whole Chicken,"c(""Chicken"", ""Poultry"", ""Meat"", ""Filipino"", ""Asian"", ""Very Low Carbs"", ""< 60 Mins"")","c(""soy sauce"", ""rice vinegar"", ""water"", ""garlic"", ""bay leaves"", ""ground black pepper"", ""roasting chickens"")","c(""Combine all ingredients but the chicken in a pot large enough to hold the chicken in one layer, more or less."", ""Bring to a boil over high heat.  Add the chicken."", ""Reduce the heat to medium-low and cook, covered for about 30 minutes, turning the chicken once or twice. (I refrigerated the chicken in the liquid for several hours after doing this to break up the cooking process)."", ""Remove the chicken and dry it gently with paper toils."", ""Boil the sauce over high heat until it is reduced to about 1 cup.  Discard bay leaves and keep the sauce warm."", 
""Broil the chicken until brown and crisp (3-4 inches from the heat) about 5 minutes per side."", ""Serve the chicken with the sauce."")",521.8
Crispy Pata  (Deep-Fried Leg of Pork),PT1H50M,Pork,"c(""Meat"", ""Filipino"", ""Asian"", ""Very Low Carbs"", ""< 4 Hours"")","c(""water"", ""salt"", ""baking soda"", ""fish sauce"", ""flour"", ""msg"", ""water"", ""vinegar"", ""soy sauce"", ""onion"", ""garlic cloves"", ""red chili pepper"")","c(""Clean pata and slit skin (3-4 slits on both sides) without cutting bone."", ""Place in a deep pan with a tight cover."", ""Add water, 7 Up and salt. Bring to a boil after 15 minutes, add baking soda. Baking soda will hasten the softening of the pata’s skin. Continue cooking for another hour or until tender. If water dries up and pata is not yet done, add another cup of water. Drain when done."", ""Hang for 1 day or place in refrigerator overnight to make skin dry. Before frying, brush with patis (fish sauce) and sprinkle with flour generously."", 
""Deep fry until crispy and golden brown. Put off heat and pour 1/4 cup water. This will make the skin more crispy."", ""ENJOY!"", ""*Prep and cooking time doesnt include drying the leg all day or overnight."")",739.5
Bacon Fried Rice With a Side of Tomatoes in Fish Sauce...,PT45M,Filipino,"c(""Asian"", ""< 60 Mins"")","c(""onion"", ""carrot"", ""garlic"", ""cooked long-grain rice"", ""eggs"", ""soy sauce"", ""butter"", ""bacon"", ""Accent seasoning"", ""black pepper"", ""tomatoes"", ""onion"", ""fish sauce"")","c(""In a large skillet, saute the bacon, garlic, carrot, peas and onion in butter until bacon is no longer pink. Remove from skillet and set aside. In same skillet, cook and stir egg over medium heat until completely set. Stir in the rice, soy sauce, accent seasoning, pepper, and bacon mixture; heat through.  Serve!"", ""Note: You may replace the eggs and bacon with tofu and add hot peppers if you are a vegetarian."", ""Tomatoes in Fish Sauce:"", ""In a bowl, combine tomatoes, onions and fish sauce. Serve with Spam or Smoked Milkfish and Fried Rice.  Yummy!""
)",244.4
Vegan Pochero,PT30M,Vegetable,"c(""Filipino"", ""Asian"", ""Vegan"", ""< 30 Mins"", ""Beginner Cook"", ""Easy"")","c(""garlic"", ""sweet onion"", ""tomato sauce"", ""cabbage"", ""Chinese cabbage"", ""green beans"", ""chickpeas"", ""plantains"", ""firm tofu"", ""sugar"", ""salt"", ""water"", ""canola oil"")","c(""In a casserole, combine the cabbage; chopped, pakchoi cabbage; sliced, green beans, sliced into two pieces (if too long), plantains; sliced into two pieces and tofu; cubed. Fill with water and boil in a few minutes until vegetables are cooked."", ""While boiling, In a wok, fry the garlic together with the onion for 1 minute."", ""Add the tomato sauce, salt and water then bring to a boil"", ""Add the sliced boiled vegetables and simmer for 5 minutes."", ""Add sugar."")",161.2
Vegan Filipino Chop Suey,PT35M,Vegetable,"c(""Filipino"", ""Asian"", ""Low Protein"", ""Vegan"", ""Low Cholesterol"", ""Healthy"", ""< 60 Mins"")","c(""garlic"", ""onion"", ""celery"", ""cabbage"", ""chayotes"", ""cauliflower"", ""carrots"", ""green pepper"", ""soy sauce"", ""water"", ""canola oil"")","c(""In a wok, fry the garlic, onion and celery for 1 minute."", ""Add the chayote fruit and cauliflower then simmer for 3 minutes or until cooked."", ""Add the water and soy sauce then bring to a boil"", ""Add the carrots and simmer for 2 minutes."", ""Add the red and green peppers."", ""Add the cabbage and the firm tofu and simmer for 1 minute."")",102
Sweet Berries and Cannoli Cream Cradle,PT30M,One Dish Meal,"c(""Chicken Breast"", ""Chicken"", ""Poultry"", ""Onions"", ""Vegetable"", ""Meat"", ""Filipino"", ""Asian"", ""Low Protein"", ""< 30 Mins"")","c(""part-skim ricotta cheese"", ""pure vanilla extract"", ""heavy whipping cream"", ""heavy whipping cream"", ""powdered sugar"", ""ground cinnamon"", ""fresh blueberries"", ""fresh strawberries"", ""sugar"", ""fresh lime juice"", ""hazelnuts"")","c(""Cannoli Cream: -- Stir the ricotta, vanilla and 3 tablespoons of cream in a medium bowl to blend."", ""Using an electric mixer, beat the remaining 1/2 cup of cream, powdered sugar, and cinnamon in a large bowl until semi-firm peaks form."", ""Fold the ricotta into the whipped cream. Place in the refrigerator for at least 15 minutes to stiffen and yield a creamier filling. (Can be prepared 1 hour ahead. Cover and refrigerate.)."", ""Sweet Berries: -- Toss the berries, sugar, and lime juice in a medium bowl to combine. Let stand until juices form, tossing occasionally, about 20 minutes."", 
""Ready to Serve: -- Divide berries among dessert dishes."", ""Dollop the ricotta cream atop the berries. Sprinkle with the nuts and serve. :)."")",377.5
Shortcut Filipino Banana Lumpia,PT15M,Dessert,"c(""Lunch/Snacks"", ""Tropical Fruits"", ""Fruit"", ""Filipino"", ""Asian"", ""Sweet"", ""< 15 Mins"", ""Easy"", ""Inexpensive"")","c(""lumpia skins"", ""plantains"", ""brown sugar"")","c(""Slice Goya ripe plaintains in half (lengthwise)."", ""Lay 2 sections of plantain on a lumpia wrapper."", ""Sprinkle some brown sugar on the plantains."", ""Wrap lumpia according to package directions."", ""Deep-fry in oil until golden brown."", ""Serve with a scoop of vanilla ice cream."", ""Enjoy!"")",147.7
Fresh Vegetable Lumpia,PT30M,Vegetable,"c(""Filipino"", ""Asian"", ""Vegan"", ""< 30 Mins"")","c(""garlic"", ""onion"", ""fresh parsley"", ""carrot"", ""jicama"", ""cabbage"", ""snow peas"", ""green beans"", ""chickpeas"", ""firm tofu"", ""salt"", ""peanut butter"", ""canola oil"")","c(""-\tIn a wok, heat oil and fry the garlic, onion, and parsley"", ""-\tAdd the jicama, carrots, snow peas and green beans then simmer for 3 minutes or until cooked and tender"", ""-\tAdd the cabbage then simmer for 2 minutes."", ""-\tAdd the peanut butter and the salt"", ""-       Add the food coloring (according to desired dullness of color)."", ""-\tAdd the tofu and the chickpeas then simmer for 1 minute."")",194.6
Mom's Filipino Chicken Adobo,PT2H5M,Chicken Thigh & Leg,"c(""Whole Chicken"", ""Chicken"", ""Poultry"", ""Meat"", ""Filipino"", ""Asian"", ""Beginner Cook"", ""< 4 Hours"", ""Easy"")","c(""whole chickens"", ""cinnamon stick"", ""peppercorns"", ""garlic cloves"", ""bay leaves"", ""soy sauce"", ""rice vinegar"", ""white sugar"", ""water"")","c(""Place the liquid ingredients in a pot, starting with about half the amount of sugar.  Taste and adjust the seasonings, the vinegar flavor will lessen during cooking, but if it is too sweet or too tart it's easier to adjust the sugar now than trying to adjust the other flavors at the end of the cooking to your preference."", ""Add the cinnamon stick, peppercorns, garlic, bay leaves and chicken.  If you don't want the seasonings in the final dish you can wrap them up in cheesecloth, but usually they're all left loose.  Pack the chicken fairly tightly in the pot and if the chicken is not covered in liquid add water, often I add about 2 cups of water.  The water can also help make the flavor less intense if the vinegar is too strong."", 
""Simmer on medium low for about 1 hour, or until the chicken is cooked through.  I often leave it until the chicken is pretty much falling off the bones.  Add water if you would like to thin out the sauce during cooking.  This can also be done in a slow cooker that you start in the morning and leave on low for 6 hours.  The meat will fall off the bone, but that just makes it easier to get at it all!"", ""Serve over rice with the sauce.  One other addition I have made, though not traditional I believe is red pepper flakes (about 1 tsp) to the seasonings.""
)",475.4
Creamy Filipino Kababayan,PT37M,Quick Breads,"c(""Breads"", ""Filipino"", ""Asian"", ""Sweet"", ""< 60 Mins"", ""For Large Groups"")","c(""salt"", ""granulated sugar"", ""cream of tartar"", ""butter"", ""bread flour"", ""cake flour"", ""baking powder"", ""vanilla extract"", ""warm water"", ""sweetened condensed milk"")","c(""Combine salt, sugar, cream of tartar and soft butter in the bowl of an electric mixer."", ""Blend for 4 minutes at lowest speed."", ""Stir together in a separate bpowl the bread flour, cake flour, and baking powder."", ""Stir together vanilla, water, yellow color and condensed milk in another small bowl."", ""Add wet and dry ingredients along with oil alternately to mixer until it forms a smooth batter."", ""Fill well-greased muffin cups with 1/2 cup batter per hole."", ""Bake for 22 minutes at 375°F."", ""Allow to cool for 5 minutes then turn out onto wire racks to finish cooling.""
)",262.4
Wok's Happening! Jimmy's Kitchen Hong Kong Style Curried Fish,PT25M,Curries,"c(""Whitefish"", ""Tilapia"", ""Cantonese"", ""Malaysian"", ""Chinese"", ""Filipino"", ""Asian"", ""Spicy"", ""Savory"", ""< 30 Mins"", ""Stir Fry"")","c(""salt"", ""egg"", ""cornflour"", ""garlic"", ""spring onions"", ""dry sherry"", ""rice wine"", ""soy sauce"", ""sambal oelek"", ""curry powder"", ""coconut milk"", ""fresh coriander leaves"")","c(""Take the fish fillets and sprinkle them with the salt on both sides, allow them to sit for about 15 minutes."", ""Whilst the fish is being salted, prepare the curry sauce. Heat the sesame oil in a wok or frying pan until hot and then fry the spring onions and garlic for about 1 to 2 minutes. Add the remaining curry sauce ingredients and turn the heat down, allow the sauce to simmer for about 2 to 4 minutes - then check the heat and seasoning and adjust to taste. If the sauce is too thick, add more coconut milk or some water."", 
""When you are ready to fry the fish, beat the egg in a large bowl, then dip the fish fillets in the cornflour and then into the beaten egg, making sure they are well coated on both sides."", ""Heat up the groundnut oil in a large wok or frying pan until it is hot, and then shallow fry the fish fillets, in batches, until they are golden brown; this takes about 4 to 8 minutes on each side, depending on the type of fish you use and the thickness of the fillets. Drain the cooked fish fillets on kitchen paper."", 
""To serve, place the freshly fried fish fillets on to a large serving platter or individual plates and pour the hot curry sauce over the top. Garnish with fresh coriander (cilantro) leaves."", ""Serve with steamed or boiled white rice and radish pickle, sweet chilli sauce and soy sauce."")",306.4
Bacon Garlic Fried Rice,PT23M,Long Grain Rice,"c(""Pork"", ""Rice"", ""Meat"", ""Filipino"", ""Asian"", ""< 30 Mins"")","c(""bacon"", ""cooked long-grain rice"", ""garlic cloves"", ""eggs"", ""light soy sauce"", ""salt"")","c(""Slice the bacon slices cross ways into small slivers.  This works well if you keep your bacon frozen.  Thaw enough to slice and then just slice off your pieces of bacon across so you have a bunch of thin strips.  Fry the slivers of bacon in a large wok or pan and then remove the bacon to drain on a paper towel.  Reserve some of the bacon fat, about 2-4 tbsp, or use vegetable oil, or use a mixture."", ""Lightly fry the garlic in the bacon fat/oil in the same pan you fried the bacon.  Don't let the garlic get brown.  Add the cold rice and the peas and carrots and let it all warm at high temperature and break up the big pieces of rice.  It's ok for there to be some clumps of rice remaining.  It is important your rice is cold when you start or the fried rice will get gluey and mushy.  Day old rice is best, but if you want to make your rice fresh and then fry it, cook the rice and put in a flat baking pan in the freezer to cool for 30-60 minutes first."", 
""After about 5 minutes, or once the rice is heated through make a well in the center of your rice.  Add your eggs and stir them slightly.  I like to cook the egg most of the way through in the well, and then slowly bring in the remaining rice which gives some eggy chunks as well as a light coating of egg on some of the rice.  Another option is to lightly fry the scrambled egg separately first and then add it to the fried rice."", ""The last step is to add the soy sauce, crumble bacon pieces over, mix, taste and add salt if desired."", 
""This fried rice is surprisingly simple, but really awesome.  I always use the frozen peas/carrots, but other veggies can work.  Never use canned veggies, and ones that release water (like tomatoes, mushrooms, zucchini, squash) can be tricky, because your rice can get mushy.  Fresh carrots, broccoli, snap peas, bell pepper, frozen/fresh corn have been tried and all work."")",298.9
