Name,TotalTime,RecipeCategory,Keywords,RecipeIngredientParts,RecipeInstructions,Calories
Mung Bean Hopia - Filipino Chinese Pastry,PT12H20M,Dessert,"c(""Lunch/Snacks"", ""Beans"", ""Chinese"", ""Filipino"", ""Asian"", ""Low Cholesterol"", ""Healthy"", ""Inexpensive"")","c(""sugar"", ""salt"", ""all-purpose flour"", ""canola oil"", ""all-purpose flour"", ""canola oil"", ""water"", ""egg"")","c(""**One 14-oz package of dried peeled split yellow mung beans makes 35 hopia. Dough recipe is for 18 hopia. It is best to cook the entire package and freeze the unused portion**."", ""MUNG BEAN PASTE FILLING."", ""In medium glass bowl, soak beans in water for 4 hours at room temperature. You can soak overnight, but place bowl in fridge to prevent bean sprouting."", ""After soaking, drain yellow water and rinse beans well. Transfer beans to medium saucepan, add fresh water about 1/8-inch above beans, and bring to boil. When beans start to soften, scoop out foamy water on top and reduce heat to medium. Continue cooking into a paste, stirring often to prevent burning. Use a wooden spoon to mash down the beans in the saucepan."", 
""When only a few intact beans remain, remove from heat and transfer paste into a microwave-proof dish or bowl. Use a potato masher to mash down the paste until very smooth. A food processor might be easier, but I haven't tried that yet."", ""Sprinkle the salt over the paste and mix well. Then add the sugar gradually, adjusting to taste. When sweet enough for you, spread paste into an even layer in the same dish and microwave on high for 5 minutes to \""dry\"" it out. The goal is for the paste to dry out enough to shape it into a ball, but not too dried out that it crumbles or burns. Set aside to cool and proceed with the doughs."", 
""DOUGH #1."", ""In a small bowl, make a well in center of flour and add oil. Combine with fork until LOOSE, coarse crumbs form; set aside."", ""DOUGH #2."", ""In a separate medium bowl, make a well in center of flour. In separate small cup, first whisk oil and water together, then pour into center of flour. Combine with fork until dough takes shape. Divide into 4 parts."", ""Flatten each part into a square about 1/8-inch thick. Do NOT flour work surface, as there is enough oil in the dough to prevent it from sticking."", 
""ASSEMBLE HOPIA."", ""For each of the flattened squares, do the following: Crumble 1/4 of Dough #1 on top of Dough #2; spread crumbs evenly but leave space about 1/2-inch from the perimeter of Dough #2 so Dough #1 does not fall off the edges."", ""Gently roll up square with your fingers like a jelly roll. Pinch the ends a tiny bit so none of Dough #1 falls out. Repeat process with remainder of flattened squares."", ""Gently roll each jelly roll back and forth under your palms, stretching into a cylinder about 1-inch in diameter. Then place cylinders on top of paper towel and chill and rest in fridge for 30 minutes, to absorb excess oil. (Do not chill overnight; dough will harden.)."", 
""After chilled rest time is up, preheat oven to 375°F."", ""Take the chilled cylinders and cut each into 5 pieces. Flatten each piece into a very thin square a bit less than 1/8-inch thick. Place a small scoop of mung bean paste in center of square. Fold edges and pinch into a ball. Place ball pinched side down onto an UN-greased cookie sheet and flatten just slightly, but not so much that the pastry skin cracks open."", ""Brush tops with beaten egg, and bake at 375°F for 20 minutes, or until BOTTOMS are slightly brown."", 
""Recommended: Store leftover hopia in Tupperware with piece of bread to keep the pastry soft. But if pastry hardens, microwave hopia for 30 seconds on High."")",265.6
Asian BBQ Ribs,PT3H30M,Pork,"c(""Meat"", ""Filipino"", ""Asian"", ""Beginner Cook"", ""Easy"")","c(""hoisin sauce"", ""soy sauce"", ""sugar"", ""ketchup"", ""garlic"")","c(""preheat oven to 275."", ""place ribs in a large baking pan."", ""mix remainder of ingredients in a seperate bowl and pour over ribs."", ""refrigerate for 1 hour."", ""bake for 1 hour."", ""turn heat to 375 and bake for 45 minutes or add to grill and grill until done."", ""plate and enjoy."")",1195.7
Buko Salad,PT2H10M,Dessert,"c(""Tropical Fruits"", ""Fruit"", ""Filipino"", ""Asian"", ""Beginner Cook"", ""< 4 Hours"", ""Easy"")","c(""heavy cream"", ""coconut"")","""Combine all ingredients leave in the freezer for 2 hours.""",1134.5
Puto,PT20M,Dessert,"c(""White Rice"", ""Rice"", ""Filipino"", ""Asian"", ""Toddler Friendly"", ""Kid Friendly"", ""Potluck"", ""Sweet"", ""Steam"")","c(""rice"", ""water"", ""baking powder"", ""white sugar"", ""sugar"", ""coconut"")","c(""You may use long grain."", ""In a heavy duty blender, puree soaked rice in water until very fine."", ""Pour in a bowl; add sugar and 2 teaspoons baking powder."", ""Mix well and set aside."", ""Beat egg whites until stiff."", ""Add 2 tablespoons sugar to keep the air in the beaten egg whites."", ""Fold the egg whites into the beaten rice batter and pour into muffin pans."", ""Steam for about 20 minutes or until done. (Optional: Sprinkle a few anise seeds on top of the puto) Serve with grated coconut."", ""Note: You may use basket steamer in a wok half filled with water.""
)",587.2
Islands Chicken &amp; Pork Filipino Adobo,PT2H,One Dish Meal,"c(""Chicken Thigh & Leg"", ""Chicken"", ""Pork"", ""Poultry"", ""Meat"", ""Thai"", ""Filipino"", ""Asian"", ""Lactose Free"", ""Egg Free"", ""Free Of..."", ""Spicy"", ""Savory"", ""< 4 Hours"", ""Easy"")","c(""chicken thighs"", ""olive oil"", ""onion"", ""garlic cloves"", ""bay leaves"", ""water"", ""rice vinegar"", ""Kikkoman soy sauce"", ""coconut milk"")","c(""In large heavy deep frying pan, melt Crisco."", ""Fry pork steak until slightly browned on each side. Set on a plate."", ""Fry chicken thighs until slightly browned on each side. Set on a plate."", ""Pour water in frying pan, and loosen any meat particles."", ""Add onions, garlic, bay leaves, 1 dried red pepper,rice vinegar, soy sauce and coconut milk."", ""Cook on low heat 15 minutes. Stir from time to time. Take out dried red pepper. Throw away."", ""Preheat oven 325*."", ""In baking pan with cover, add browned meat."", 
""Add with sauce. Bake 1 1/2 hours."", ""Throw away bay leaves before serving. I like to make a platter of rice and put chicken and pork with sauce on top. I also serve lemon slices dipped in salt. Placed on the side of the platter."")",528.2
Lumpia-Stuffed Wrappers (Lumpia Labong),PT1H30M,Pork,"c(""Vegetable"", ""Meat"", ""Filipino"", ""Asian"", ""< 4 Hours"")","c(""garlic cloves"", ""onion"", ""pork"", ""shrimp"", ""bamboo shoots"", ""Chinese cabbage"", ""salt"", ""fresh bean sprout"", ""lumpia skins"", ""lettuce"", ""cornstarch"", ""brown sugar"", ""soy sauce"", ""water"")","c(""Prepare sauce: Combine all sauce ingredients in a small saucepan. Stir over medium heat until slightly thickened."", ""Heat 2 TBSP oil in a wok or large skillet. Add garlic and onion; saute until transparent. Add pork, shrimp, bamboo shoots, cabbage, and salt. Stir-fry 2 to 3 minutes, adding more oil if needed. Stir in bean sprouts; keep warm."", ""Keep wrappers covered until used. Top each wrapper with a lettuce leaf and 1 to 2 tablespoons filling; fold end of wrapper over stem-end of lettuce. Roll wrapper and filling, with some of the lettuce and filling extending from open end of wrapper."", 
""In wok or skillet, heat about 1\"" of peanut oil to 375ºF. Fry lumpia, 2 or 3 at a time, until golden brown, turning frequently. Drain lumpia on paper towels."", ""Arrange filled wrappers on a platter. Serve with Lumpia Sauce."")",157
Easy White Puto,PT20M,Quick Breads,"c(""Breads"", ""Filipino"", ""Asian"", ""Healthy"", ""< 30 Mins"", ""Easy"")","c(""Bisquick"", ""milk"", ""sugar"", ""egg"")","c(""Combine all the above ingredients into a bowl.  Grease a backing tin of small muffin cups or use cupcake liners."", ""Pour the Puto mix in each on to half full.  Place inside a larger pan with at least an inch of water, and cover with foil.  Place in 350 degree oven and steam approximately 8 to 10 minutes.  Remove and serve."")",124.8
Egg Balls (Yema),PT20M,Dessert,"c(""Filipino"", ""Asian"")","c(""milk"", ""sugar"", ""vanilla extract"", ""confectioners' sugar"")","c(""In a saucepan, simmer milk over low heat until it is reduced to 1 cup."", ""Stir in sugar until well blended. Turn off heat and let cool."", ""Mix 3 tablespoons of the simmered milk with the egg yolks and then add this mixture gradually to the milk in the pan."", ""Stir in vanilla extract and continue stirring over low heat until mixture thickens."", ""Remove from heat and let cool."", ""Shape into balls, using one tablespoon of the mixture to make one ball."", ""Roll finished balls in confectioner's sugar.""
)",440.6
Chicken Adobo,PT40M,Chicken,"c(""Poultry"", ""Meat"", ""Filipino"", ""Asian"", ""< 60 Mins"")","c(""chicken"", ""salt"", ""pepper"", ""bay leaf"", ""vinegar"", ""garlic cloves"")","c(""Clean and cut chicken into pieces."", ""Season with salt and pepper."", ""Place in a saucepan and add bay leaf, garlic, and vinegar.  Let simmer until tender."", ""If water is needed, add 1/2 cup hot water at a time."", ""When the meat is tender, add the oil and saute until brown.  Serve hot."")",316
Ginger Tea Salabat,PT10M,Beverages,"c(""Filipino"", ""Asian"", ""Low Protein"", ""Low Cholesterol"", ""Healthy"", ""< 15 Mins"", ""Easy"")","c(""fresh ginger"", ""water"", ""brown sugar"")","c(""Boil all ingredients together."", ""Add more water if too strong."")",127.2
Coconut Rice (Mochi-Bibinka) Philippines,PT1H15M,Dessert,"c(""Short Grain Rice"", ""Rice"", ""Coconut"", ""Fruit"", ""Nuts"", ""Southwest Asia (middle East)"", ""Filipino"", ""Asian"", ""Healthy"", ""For Large Groups"", ""< 4 Hours"", ""Easy"")","c(""rice"", ""coconut milk"", ""dark brown sugar"")","c(""Rinse rice and cook in rice cooker.  In saucepan combine coconut milk and 1 1/4 cups of the brown sugar.  Cook over medium heat stirring constantly until thickened, about 20 minutes.  Preheat oven to 350 degrees F."", ""Put cooked rice into a large bowl.  Reserving 1/2 cup of coconut mixture, stir remainder and remaining brown sugar evenly into hot rice.  Put into pans that are prepared by greasing them.  Top with reserved 1/2 cup of coconut milk mixture.  Bake for 20 minutes the broil for 5 minutes to set topping.  Cut into small pieces.""
)",139
Avocado Milkshakes,PT10M,Dessert,"c(""Filipino"", ""Asian"", ""Low Protein"", ""< 15 Mins"", ""Easy"")","c(""avocado"", ""sugar"", ""vanilla ice cream"")","c(""Combine all ingredients together in a blender, and blend well."", ""Pour into nice tall glasses, and garnish with a little whipped cream and a mint sprig."", ""Enjoy!"")",807.6
Peanut Squares - Philippine,PT55M,Candy,"c(""Dessert"", ""Fruit"", ""Nuts"", ""Filipino"", ""Asian"", ""< 60 Mins"", ""For Large Groups"", ""Beginner Cook"", ""Easy"")","c(""roasted peanuts"", ""sugar"", ""milk"", ""sugar"")","c(""Put the peanuts through a meat grinder with a medium blade.  Then place them in a saucepan with the 1/2 cup of sugar and the milk.  Mix well."", ""Place the peanut mixture over medium flame and cook, stir constantly, until the mixture boils and the sugar dissolves."", ""Lower the flame and cook, stir often,until the mixture thickens.  As the mixture gets very thick, stir continually, to prevent sticking.  This will take about 15 minutes."", ""When the mixture is so thich that you can see the bottom of the pan when you stir, remove from the stove."", 
""Sprinkle the 1/4 cup sugar on the pastry board.  Turn the peanut mixture out onto the sugar and flatten it out with a spatula.  Allow to cool so you can handle it."", ""Roll it out with a rolling pin until the mixture is about 1/4 inch thick.  With a knife, cut the mixture into small squares or with a cookie cutter."", ""Remove the squares from the board with a metal spatula."")",56.2
Kutsinta - Philippines Brown Rice Cake,PT45M,Dessert,"c(""Rice"", ""Filipino"", ""Asian"", ""Low Protein"", ""Low Cholesterol"", ""Healthy"", ""< 60 Mins"", ""Easy"")","c(""brown sugar"", ""water"", ""water"", ""coconut"")","c(""In a mixing bowl, combine all the ingredients and mix well."", ""Pour into muffin cups, until half full."", ""Steam in a large pan with a cover; the water should be 2 inches deep."", ""Cook for 30 minutes or until a toothpick inserted comes out clean."", ""Add more water if needed until cooking is done."", ""Remove from the muffin pans and serve with freshly grated coconut."")",559.3
Original Leche Flan - Philippines,PT1H20M,Dessert,"c(""Filipino"", ""Asian"", ""< 4 Hours"")","c(""sugar"", ""water"", ""milk"", ""vanilla"")","c(""Caramel:"", ""Put sugar and water in a saucepan. Caramelize on high heat.  Line loaf tin with caramel.  Be sure to line the sides of the pan."", ""Custard:"", ""Blend all ingredients in a blender.  Pour mixture into caramel lined loaf pan."", ""Cover with aluminum foil.  Place tin in a larger baking pan half filled with water.  Place pan in pre-heated oven at 375 degrees, and bake flan for about 1 hour or until firm."", ""Place serving dish over top of loaf pan, and invert.  Flan will easily plate, and the caramel provides a wonderful sauce.""
)",511.9
Lumpia (Filipino Egg Roll),PT48M,Lunch/Snacks,"c(""Pork"", ""Meat"", ""Filipino"", ""Asian"", ""< 60 Mins"")","c(""lumpia skins"", ""ground beef"", ""ground pork"", ""green onion"", ""carrot"", ""celery"", ""egg"", ""soy sauce"", ""ground pepper"", ""flour"", ""water"")","c(""Brown beef and pork, until almost completely cooked. Drain fat. Cool and process in food processor or chop up into fine pieces (like Taco Bell taco meat or a little coarser) with fork."", ""Combine meats, vegetables, egg, sauces, pepper in a large bowl. Cover and refrigerate for 30 minutes to 1 hour for flavors to set inches I like to prepare my filling the day before so it can marinate all night."", ""Prepare wrapper (by separating) and place on a separate plate. Place 1 to 2 T of filling in the center of the wrapper."", 
""Fold left edge over all the way, then bring down top and bottom, then roll the rest of the way to the right, making a roll. hard to explain without a picture, but you'll figure it out -- looks like an egg roll when done, only thinner and longer.  Seal with with flour and water mixture."", ""After you have assembled all the lumpia, heat your oil (I use the deep fryer) to 375 degrees. Cook until golden brown, turning often, approximately 3 minutes. Drain on paper towels."", ""Serve with sweet and sour sauce."", 
""Note: the wrapper packages usually have instructions for rolling the wrap. Times vary by experience and methods used."")",141.7
Refreshing Far East Fruit Salad,PT15H15M,Dessert,"c(""Oranges"", ""Pineapple"", ""Citrus"", ""Tropical Fruits"", ""Fruit"", ""Filipino"", ""Asian"", ""Summer"", ""Beginner Cook"", ""Easy"", ""Inexpensive"")","c(""confectioners' sugar"", ""mandarin orange sections"", ""pineapple"", ""sweetened coconut"")","c(""Whip cream with confectioner's sugar in large chilled bowl."", ""Mix next 4 ingredients & fold into whipped cream."", ""Chill thoroughly, at least an hour; confectioner's sugar helps stabilize whipped cream. If planning to keep overnight, stabilize whipped cream with gelatin."", ""Stir in nuts just before serving."")",947.6
Philippine Mung Beans in Coconut Milk,PT1H30M,Stew,"c(""Chard"", ""Coconut"", ""Greens"", ""Beans"", ""Fruit"", ""Vegetable"", ""Nuts"", ""Filipino"", ""Asian"", ""Vegan"", ""< 4 Hours"")","c(""onion"", ""salt"", ""fresh chili pepper"", ""garlic cloves"", ""coconut milk"", ""soy sauce"", ""chard leaves"")","c(""Soak the beans in water for several hours or overnight. Drain, then cook them until tender (about 1 hour). Drain."", ""While the beans are cooking, saute the onions in the oil with salt."", ""When translucent, add ginger, chiles, and garlic. Simmer on low heat for a few minutes."", ""Add the coconut milk and simmer for 5 more minutes."", ""Combine the beans and the coconut milk mixture in a large pot. Add the soy sauce and chard, and cook until the chard wilts."", ""Remove from heat and serve (I like it with rice).""
)",486.2
Monkey Meat Kabobs,PT1H,Pork,"c(""Meat"", ""Filipino"", ""Asian"", ""Very Low Carbs"", ""High Protein"", ""High In..."", ""< 60 Mins"")","c(""chicken broth"", ""garlic"", ""ginger"", ""pepper"")","c(""Cut up pork steaks into bite size pieces."", ""Mix the teriyaki, chicken broth, garlic, ginger and pepper together."", ""Place the meat in a container and pour the marinade over it."", ""Place an air tight lid on the container and marinate overnight."", ""Place on presoaked bamboo skewers."", ""Grill on a foil covered grill that has been sprayed with cooking spray."", ""Grill until dark brown; 20 minutes is a guess; it really depends on the cut of the meat and the temperature of your grill."", ""Great served with rice.""
)",123
Budbud Pilit,PT50M,Breakfast,"c(""Lunch/Snacks"", ""White Rice"", ""Rice"", ""Filipino"", ""Asian"", ""< 60 Mins"", ""For Large Groups"", ""Steam"", ""Easy"")","c(""glutinous rice"", ""coconut milk"", ""sugar"", ""salt"")","c(""Wash malagkit very well. Drain."", ""Cook with coconut milk, salt, and sugar in a wok, stirring constantly."", ""When mixture is almost dry, stir to prevent it from sticking to the bottom of the wok."", ""Reduce the heat, and cover the mixture with banana leaves for a few minutes."", ""Wrap 2 tablespoon of the cooked malagkit in wilted banana leaves."", ""Tie in pairs, and steam for about 30 minutes in a big pot."", ""Serve with hot chocolate or ripe mangoes."")",264.1
Goat Caldereta,PT2H30M,Stew,"c(""Meat"", ""Filipino"", ""Asian"", ""< 4 Hours"")","c(""distilled white vinegar"", ""salt"", ""olive oil"", ""garlic cloves"", ""onion"", ""cinnamon sticks"", ""bay leaves"", ""tomato paste"", ""potatoes"", ""red bell pepper"", ""whole black peppercorn"", ""fresh ground black pepper"")","c(""Put the cubed meat into a bowl and add the vinegar, salt and pepper. Set aside for 30-40 minutes."", ""Drain the meat, saving the liquid,  and pat it dry."", ""In a large heavy sauce pan, heat the oil over medium heat. Put as many cubes o meat into the pan as it will fit without crowding."", ""Brown the meat on all sides and repeat until all of the meat is browned. Remove meat from pan."", ""Put the onion and garlic into the pan and cook for 2 minutes., scraping up any pan juices."", ""Put in black peppercorns, cinnamon stick and bay leaves."", 
""Stir and cook for another minute."", ""Return the meat into the pan with its accumulated juices, reserved marinade and the tomato paste."", ""Stir and cook for another minute."", ""Add 2 cups of waters and bring to boil."", ""Cover, bring the heat to low and cook for 15 minutes."", ""Meanwhile, peel the potatoes and cut them into 1 1/2 inch cubes."", ""When the meat has cooked for 15 minutes, add the potatoes."", ""Cover, and continue to cook for 45-60 minutes or until the meat is tender."", ""Seed the bell pepper and cut it into 1/4 inch wide strips."", 
""When the meat is tender add the pepper into the stew."", ""Stir and cook for another 3-5 minutes."")",482
Budbud Kabog Recipe,PT3H,Breakfast,"c(""Grains"", ""Filipino"", ""Asian"", ""For Large Groups"", ""< 4 Hours"")","c(""fresh coconut"", ""warm water"", ""water"", ""sugar"", ""salt"")","c(""Preparation stage:"", ""Grate two of the mature coconuts to get the meat and add 2 cups of warm water to the meat. Extract the mild manually and pass through a piece of cheesecloth. After the first extraction, add another 2 cups of warm water to the grated coconut meat and extract again."", ""Repeat the process until you have 6 cups or more of coconut milk. You can mix the first and second pressings together but set the third pressings aside in case you'll need it in the latter part of the cooking."", 
""Wash the millet in two changes of water. Drain and set aside. If using fresh banana leaves, cut off the mid ribs and run each half of the leaf over fire to wilt the leaves and make them pliable for wrapping. Tear leaves into 6 inches in width until you have about 100 pieces. Do not use leaves which have tears in the center. Set these aside and cut them into tiny strips to use for tying up the budbud in pairs."", ""Using coconut meat from where you extracted the milk, wipe each piece of banana leaf so that the leaf wrapper is clean and oiled from the residue of he coconut meat."", 
""Cooking stage:"", ""Add salt to 6 cups of the coconut milk and bring to boil, stirring occasionally. This process will thicken the milk. Once it starts to slow boil, add the washed millet. Stir constantly until the millet starts to cook, making sure that the mixture doesn't stick to the bottom of the pan to form a crust. It has come to boil when you see bubbles of steam coming out from the mixture like a slowly erupting volcano."", ""Add sugar and salt and mix well. The color will become a darker yellow. Continue stirring constantly until cooked, about 30 more minutes. The suman is already cooked and can be eaten. Set aside for wrapping."", 
""Wrapping and final cooking stage:"", ""Put a heaping tablespoon of the cooked millet onto the center of a cut piece of wilted banana leaf. Gently form the millet into a 5-inch log with a diameter of 1 inch. You can do this by rolling the mixture in the banana leaf without having to touch the millet mixture. Once you have the rolled mixture into shape, tighten the roll and fold one end and then the other. Do this until you have finished all the millet."", ""Put two pieces of suman together with the flaps facing each other. Tie both ends with the cut-up leaf string. Repeat with remaining pieces."", 
""Place all the paired suman in a steamer with enough water to steam the suman for an hour. The suman should be steamed from the very start when you put the water in the steamer. The suman is ready when the color of the leaf changes from light green to dark green. Minimum time is one hour of steaming. The traditional way of eating this suman is with mango and hot chocolate."")",63.1
Phillipino Chicken With Noodles,PT1H,Chicken,"c(""Poultry"", ""Meat"", ""Filipino"", ""Asian"", ""< 60 Mins"")","c(""garlic"", ""onion"", ""chicken pieces"", ""pepper"", ""water"", ""cellophane noodles"", ""green onion"")","c(""Saute garlic in oil until brown."", ""Add onion, chicken, patis and pepper.  Cover; bring to boil, then simmer for 10 minutes."", ""Add water; bring to boil.  Simmer until chicken is cooked.  The dish should be covered, but leave lid off part of the time."", ""Remove chicken from broth.  Take off meat, shred, and throw back into the pot.  Discard skin and bones."", ""Add broken up noodles and cook another 5 minutes."", ""Spoon noodles, chicken  and broth into bowls; sprinkle with scallions before serving.""
)",471.5
Pork (Chicken) Adobo,PT1H,White Rice,"c(""Pork"", ""Rice"", ""Onions"", ""Vegetable"", ""Meat"", ""Filipino"", ""Asian"", ""< 60 Mins"", ""Stove Top"")","c(""yellow onion"", ""garlic"", ""pork"", ""white vinegar"", ""water"", ""soy sauce"", ""paprika"", ""olive oil"", ""cornstarch"", ""water"")","c(""Finely dice the onion and garlic (note that this is a whole head of garlic, not just a single clove.)."", ""Brown the finely diced onion and the garlic in a large pot with a little oil."", ""Cut the pork or chicken into 1”x1” to 1”x3” pieces. If using bone-in, just cut away some of the larger pieces from the bone."", ""Add the 1 cup of vinegar and 1 cup of water to the onion/garlic."", ""Bring it to a low boil at about medium-high."", ""Add the meat and continue to cook at or near boiling for a minimum of 20 minutes."", 
""Sometime during the 20 minutes, add the balsamic vinegar (to taste). I usually cook it for more than 20 minutes. The extra time doesn’t hurt the meat and actually makes it tenderer (Probably because of the vinegar)."", ""With about ten minutes left, add the soy sauce."", ""If you cook it as long as I do (30-40 minutes), you will want to have an extra cup of water and some vinegar (white) on hand since the mixture will probably reduce too much."", ""When the meat is tender, pull it out of the gravy and brown it in a little oil in a separate pan. I sometimes sprinkle a little bit of paprika on it at this point for both color and flavor."", 
""While the meat is browning use a cold water roux made from a one-to-one ratio of  cornstarch and water to thicken the remaining gravy."", ""The meat can be remixed with the gravy after browning or served separately. I usually put the meat and gravy together and serve it over the rice. Sometimes I serve the chicken and rice separately, dousing both with gravy."")",608.4
Mixed Noodles,PT25M,Lunch/Snacks,"c(""Chicken"", ""Poultry"", ""Meat"", ""Filipino"", ""Asian"", ""Healthy"", ""< 30 Mins"")","c(""onion"", ""garlic clove"", ""cabbage"", ""light soy sauce"", ""cooked ham"", ""pepper"", ""lemon wedge"")","c(""Soak egg noodles in warm water for 10 minutes to loosen strands. Drain. Boil noodles in lightly salted water for 3 minutes or until tender but still firm to bite. Drain."", ""Heat oil in a wok and fry finely sliced onion and finely chopped garlic until golden."", ""Add shredded cabbage and stir fry for 2 minutes. Add soy sauce mixed with 2 tablespoons of water, cover and cook for 3 minutes."", ""Add prawns, chicken, ham and noodles. Toss and fry until heated through and no liquid remains."", ""Season with pepper and serve."", 
""Garnish with lemon wedges to add piquancy to individual serves."", ""Tip. Cooked pork can be used instead of chicken or as an extra."")",449.8
