Name,TotalTime,RecipeCategory,Keywords,RecipeIngredientParts,RecipeInstructions,Calories
Classic Filipino Chicken Adobo,PT0S,Chicken,"c(""Poultry"", ""Meat"", ""Filipino"", ""Asian"", ""< 15 Mins"")","c(""chicken pieces"", ""garlic"", ""white vinegar"", ""black peppercorns"", ""bay leaf"", ""soy sauce"", ""salt"", ""potatoes"", ""water"")","c(""Combine all ingredients in a deep glass or stainless steel sauce pan."", ""Bring to a boil over medium heat, then reduce heat to medium low."", ""Cover and simmer for  about 30 minutes or until the meat is very tender."", ""Gently turn the meat  occasionally during the course of cooking."", ""Remove the meat from the sauce and  pan-fry in a little oil until browned on all sides."", ""Transfer to a serving  platter or bowl and cover with sauce. Serve with warm steamed rice."", ""While the recipe says to saute the meat after it's cooked, I usually brown the  meat before adding the remainder of the incredients. I have no idea what  difference this makes, if any."", 
""I adapted this from a recipe in Philippine  Recipes Made Easy, by Violeta A. Noriega."")",314.3
Couscous with Chicken and Tomatoes,PT40M,Lunch/Snacks,"c(""Whole Chicken"", ""Chicken"", ""Poultry"", ""Vegetable"", ""Meat"", ""Lebanese"", ""Southwest Asia (middle East)"", ""Filipino"", ""African"", ""Asian"", ""Indian"", ""Low Cholesterol"", ""Kid Friendly"", ""< 60 Mins"", ""Beginner Cook"", ""Stove Top"", ""Easy"")","c(""chicken"", ""chickpeas"", ""garlic"", ""onion"", ""carrots"", ""tomatoes"", ""tomato puree"", ""parsley"", ""couscous"", ""olive oil"")","c(""Peel and trim the vegetables."", ""Fry the chicken pieces in half the olive oil until lightly browned."", ""Add the sliced onion and the chopped garlic, the tomato purée and enough water just to cover the chicken."", ""Season generously and simmer for 10 minutes."", ""Add the cooked chick peas, the carrots, cut into batons (lengthwise into quarters), and the tomatoes, cut into 8 pieces each."", ""Mix the couscous with its own volume of water and the remaining olive oil."", ""Stir it and leave it to swell up for about 15 minutes."", 
""To cook: place it in a colander or sieve over a pan of boiling water (traditionally its done over the stew but this can be hazardous), steam for 20-25 minutes until swollen and cooked through."", ""To serve: stir a knob of butter into the couscous and pile in a ring around a large dish."", ""Spoon the chicken and vegetables into the centre of the dish and pass the sauce separately."", ""It can have a little chili added to give it extra pungency."")",779.2
Beef Steak,PT57M,Lunch/Snacks,"c(""Filipino"", ""Asian"", ""< 60 Mins"", ""Stir Fry"")","c(""lemon juice"", ""soy sauce"", ""water"", ""garlic"", ""ginger"", ""flour"", ""ground black pepper"", ""onion"")","c(""Marinate the steak in lemon juice,soy sauce,garlic,ginger and pepper for 30 minutes."", ""Pan fry in 2 tbsp of oil add the marinated steak cook slow until done."", ""When steak are cooked remove them from the pan onto a serving dish."", ""Dissolve the flour with water."", ""Add the remaining oil in the same pan and pan fry the onion until tender and add the dissolve flour for 1 minute."", ""Pile on the of steaks Serve hot with plain rice."")",53.4
"Beef Cubes, Pineapple Cubes, Carrots and Potato",PT52M,Pineapple,"c(""Potato"", ""Tropical Fruits"", ""Fruit"", ""Vegetable"", ""Meat"", ""Filipino"", ""Asian"", ""Low Protein"", ""Low Cholesterol"", ""Healthy"", ""Pressure Cooker"", ""< 60 Mins"", ""Stove Top"", ""Easy"")","c(""beef"", ""pineapple"", ""water"", ""vinegar"", ""onion"", ""garlic cloves"", ""ground ginger"", ""carrots"", ""potatoes"", ""ground oregano"", ""fresh tomato"", ""black pepper"", ""salt"", ""ketchup"")","c(""Place the beef cubes with water in the pressure cooker for 15 minutes."", ""Add the onion, garlic, ginger for 2 minutes."", ""Put together all the remaining Ingredients and cook for 15 minutes."")",256.3
Chili Crabs,PT24M,Lunch/Snacks,"c(""Crab"", ""Filipino"", ""Asian"", ""Microwave"", ""< 30 Mins"")","c(""garlic"", ""ginger"", ""chili sauce"", ""tomato sauce"", ""red chile"", ""ground pepper"", ""sugar"", ""salt"", ""water"", ""cornflour"", ""lettuce leaves"", ""coriander leaves"")","c(""Place the crabs,cooking oil,garlic,ginger in a Microwave safe casserole and cook on high for 5-6 miumntes or until aromatic."", ""Add the chili,garlic sauce,tomato sauce,red chilli,pepper,sugar, and salt and cook on power high for 45 second."", ""Stir in the crabs,cover and cook for 5 minutes."", ""Stir at half cooking time."", ""Stir the water and cornflour,cover on power high for 3 minutes or until the sauce thickened and crabs are cooked."", ""Serve hot plain rice or bread."")",231.8
Chicken or Pork Adobo,PT50M,Lunch/Snacks,"c(""Chicken"", ""Pork"", ""Poultry"", ""Meat"", ""Filipino"", ""Asian"", ""Very Low Carbs"", ""High Protein"", ""High In..."", ""< 60 Mins"", ""Stove Top"", ""Easy"")","c(""chicken thighs"", ""vinegar"", ""soy sauce"", ""garlic"", ""salt"", ""peppercorn"", ""bay leaf"")","c(""If using pork, cut pork into 1 1/2-inch pieces."", ""In a large sauce pot, combine all ingredients."", ""Cover and let stand for 1 to 3 hours."", ""Bring to a boil; lower heat and simmer for 30 minutes (45 minutes for pork)."", ""Uncover and simmer 15 more minutes or until liquid evaporates and chicken or pork is lightly browned."")",496.4
Lumpia (philippine Egg Rolls from Scratch),PT30M,Lunch/Snacks,"c(""Pineapple"", ""Pork"", ""Tropical Fruits"", ""Fruit"", ""Vegetable"", ""Meat"", ""Filipino"", ""Asian"", ""Kid Friendly"", ""Potluck"", ""< 30 Mins"", ""Stove Top"", ""Easy"")","c(""flour"", ""water"", ""salt"", ""ground pork"", ""beef"", ""raw shrimp"", ""onion"", ""water chestnuts"", ""bamboo shoots"", ""celery"", ""garlic"", ""carrot"", ""bean sprouts"", ""raisins"", ""ketchup"", ""vinegar"", ""brown sugar"", ""ginger"", ""salt"", ""cornstarch"")","c(""Doilies: Combine flour, water and salt to taste and mix thoroughly with a wire whisk to remove lumps."", ""Batter should be about the consistency of a crepe batter."", ""Add a little water if it is too thick."", ""If the batter thickens as it sits, you may have to add more water."", ""Heat a 6\"" crepe pan and wipe out with lightly oiled wax paper."", ""Pour on batter quickly to cover the bottom."", ""Pour off excess."", ""Allow to cook over low heat until the edges begin to curl and pull away from the sides of the pan."", 
""Remove and place on clean, dry surface."", ""Repeat, oiling pan each time."", ""Do not stack doilies on top of each other until each has cooled."", ""Before filling, put off excess batter to make a perfect circle."", ""Filling: Cook pork or beef in a large skillet until pinkness is gone."", ""Drain off grease."", ""Add shrimp, onions, water chestnuts, bamboo shoots, celery, garlic and carrot; cook until carrot is almost tender."", ""Stir in remaining ingredients except the egg white and oil."", ""Mix well."", ""Cook until bean sprouts are limp."", 
""Pour mixture into strainer and cool, allowing as much liquid as possible to drain off before filling rolls."", ""Use about 1 heaping teaspoon for each doily."", ""Place filling near one side."", ""Roll doily over filling a couple of times; fold in sides and roll up tightly."", ""Seal flap with a little egg white."", ""Deep fry in corn oil heated to about 375F degrees, until rolls are golden."", ""Drain thoroughly on paper towels and serve with sauce."")",80.7
PAKSIW NA ISDA (Boiled Pickled Fish and Vegetables),PT35M,Lunch/Snacks,"c(""Melons"", ""Fruit"", ""Vegetable"", ""Filipino"", ""Asian"", ""< 60 Mins"", ""Refrigerator"", ""Stove Top"", ""Easy"")","c(""vinegar"", ""water"", ""salt"", ""ginger"", ""banana peppers"", ""bitter melon"", ""eggplant"")","c(""Cut fish into 4 slices."", ""Place fish in a teflon or porcelain coated skillet."", ""Add all other ingredients, except ampalaya and eggplant, cover and bring to a boil."", ""Let simmer about 10 minutes, turning fish once to cook evenly."", ""Transfer to a covered dish and store in the refrigerator to\""age\"" for 2 days."", ""Reheat over moderate heat just until heated enough before serving."", ""Add ampalaya and eggplant during the last five minutes of cooking."")",5.2
TRADITIONAL ADOBO (Pork in Vinegar and Soy Sauce),PT1H5M,Lunch/Snacks,"c(""Pork"", ""Meat"", ""Filipino"", ""Asian"", ""Very Low Carbs"", ""Weeknight"", ""< 4 Hours"", ""Easy"")","c(""vinegar"", ""soy sauce"", ""salt"", ""garlic"", ""bay leaf"", ""pepper"", ""sugar"", ""water"")","c(""Combine all ingredients except cooking oil in a pot and let stand for at least 30 minutes."", ""Simmer covered for 1 hour or until meat is tender."", ""Drain and reserve the sauce."", ""Heat cooking oil in a skillet."", ""Brown meat on all sides."", ""Transfer to a serving dish."", ""Pour off all remaining oil from skillet."", ""Add reserved sauce and cook for a minute or two scraping all browned bits sticking to pan."", ""Pour sauce over meat and serve."")",324.3
Hot & Sour Shrimp,PT37M,Lunch/Snacks,"c(""Vegetable"", ""Filipino"", ""Asian"", ""Potluck"", ""< 60 Mins"", ""Stove Top"", ""Easy"")","c(""shrimp"", ""dry sherry"", ""fresh ginger"", ""canned broth"", ""soy sauce"", ""catsup"", ""cornstarch"", ""rice vinegar"", ""white wine vinegar"", ""sugar"", ""cayenne pepper"", ""walnuts"", ""watercress"", ""bell peppers"", ""garlic"", ""green onions"")","c(""Combine shrimp, 2 tablespoons Sherry and grated ginger in large bowl."", ""Cover and refrigerate for 30 minutes."", ""Mix remaining 2 tablespoons Sherry, chicken stock, soy sauce, catsup, cornstarch, rice vinegar, sugar, sesame oil and cayenne pepper in small bowl."", ""Heat 2 teaspoons peanut oil in wok or heavy large skillet over high heat."", ""Add walnuts and stir-fry for 1 minute."", ""Transfer walnuts to plate using slotted spoon."", ""Add watercress to wok and stir-fry until just wilted, about 1 minute."", 
""Divide watercress among plates."", ""Add 2 teaspoons peanut oil, bell peppers and garlic to wok and stir-fry for 1 minute."", ""Add remaining 2 teaspoons peanut oil, shrimp mixture and onions and stir- fry for 1 minute."", ""Stir stock mixture, add to wok and cook sauce until clear and thick, stirring frequently, 2 minutes."", ""Spoon sauce and shrimp over watercress."", ""Sprinkle with walnuts and serve."")",261.4
Cascaron - Bitsu-Bitsu (Dough Balls),PT25M,Dessert,"c(""Filipino"", ""Asian"", ""Vegan"", ""< 30 Mins"", ""Stove Top"", ""Easy"")","c(""coconut"", ""hot water"", ""dark brown sugar"", ""cold water"")","c(""Squeeze grated coconut in water then strain coconut water in clean dish towel or cheesecloth over another bowl."", ""Squeeze until all liquid has been extracted (Instead of fresh coconut, you may use 1/2 can of grated coconut and 1 1/2 cups of water)."", ""Place canned coconut in 1 package of mochi flour and add water until dough is soft but not too sticky."", ""Do the same with fresh coconut."", ""Shape dough in balls of 1 inch diameter and fry in deep fat until golden brown."", ""Drain dough balls on paper towel."", 
""Then put them in a large mixing bowl."", ""When all have been fried, boil water and 1/3 box brown sugar in a small sauce pan until it reaches the soft boil stage."", ""This is done by placing a drop of syrup in a bowl of cold water."", ""If it retains it shape and is soft, it is ready."", ""Pour over dough balls."", ""Mix well so that all are coated with syrup."", ""Remove from bowl and place them in a platter to cool."", ""Excellent with coffee or tea."")",0
Menudo,PT40M,Stew,"c(""Lunch/Snacks"", ""Beef Organ Meats"", ""Meat"", ""Filipino"", ""Asian"", ""< 60 Mins"", ""Stir Fry"")","c(""liver"", ""pork"", ""potatoes"", ""garbanzo beans"", ""tomatoes"", ""garlic"", ""onion"", ""water"", ""shortening"", ""salt"")","c(""Cook pork in water to cover until tender."", ""Dice."", ""Saute garlic,onion and tomatoes in shortening."", ""Add pork and liver and continue sauteing for 5 minutes."", ""Add water and salt,and pimenton (to color)."", ""Add potatoes and cooked garbanzos."", ""Cook until potatoes are done."")",178.3
KARI-KARE (Meat and Vegetable Stew in Peanut Sauce),PT2H15M,Stew,"c(""One Dish Meal"", ""Lunch/Snacks"", ""Pork"", ""Vegetable"", ""Meat"", ""Filipino"", ""Asian"", ""Weeknight"", ""Stove Top"", ""< 4 Hours"", ""Easy"")","c(""stewing beef"", ""salt"", ""garlic"", ""onion"", ""achute water"", ""peanut butter"", ""powdered rice"", ""green beans"", ""eggplant"")","c(""Place hocks or oxtail pieces in a large pot."", ""Add enough water to cover."", ""Bring to boil, lower heat and simmer for 1-1/2 hours or until tender."", ""If using achute water, soak 1 tablespoon of achute seeds in water for 30 minutes."", ""Squeeze seeds between your thumb and finger tips until the water turns red."", ""Strain and set red water aside."", ""OR Heat 2 tablespoons oil, saute achute seeds in oil until oil turns red, discard seeds."", ""Use oil for sauteing rest of ingredients."", ""Heat oil in a skillet and saute garlic and onions."", 
""Add cooked meat and 2 cups of the broth."", ""(Save the rest of the broth for other uses.) Add salt and achute water."", ""Simmer for 15 minutes."", ""Stir in peanut butter and toasted rice powder, bring back to simmer cook, stirring for 5 minutes."", ""Add green beans and eggplant."", ""Cook 10 minutes or until vegetables are tender, stirring occasionally."", ""Correct the seasonings."", ""Serve with hot rice and bagoong, plain or sauteed."")",130
Pochero,PT1H,Stew,"c(""One Dish Meal"", ""Yam/Sweet Potato"", ""Chicken"", ""Pork"", ""Potato"", ""Poultry"", ""Beans"", ""Vegetable"", ""Meat"", ""Filipino"", ""Asian"", ""< 60 Mins"", ""Stove Top"")","c(""chickpeas"", ""chicken"", ""pork"", ""chorizo sausage"", ""onion"", ""salt"", ""whole black peppercorn"", ""garlic"", ""onion"", ""tomatoes"", ""sweet potato"", ""bok choy"", ""green onions"")","c(""Wash chick peas and soak overnight (or use a can of Garbanzo beans)."", ""In one pan put in the chick peas chicken, pork, chorizo and add water to cover."", ""Add sliced onion, salt& peppercorns, bring to a boil."", ""Reduce heat and simmer until meats and chick peas are almost tender."", ""In another pan heat oil and fry garlic with the chopped onion on low heat, stirring frequently until golden brown."", ""Add tomatoes and cook to a pulp."", ""Add meats, stock& sweet potatoes."", ""Simmer until potatoes are nearly cooked then add cabbage& green onions for the last few minutes."", 
""Serve broth as soup and the meats& vegetables as a separate course."")",798.3
Siopao,PT3H20M,Chicken,"c(""Poultry"", ""Meat"", ""Filipino"", ""Asian"", ""Healthy"", ""Weeknight"", ""< 4 Hours"")","c(""flour"", ""active dry yeast"", ""chicken thigh"", ""white sugar"", ""water"", ""boiling water"", ""eggs"", ""green onions"", ""light soy sauce"", ""brown sugar"", ""oyster sauce"", ""cornstarch"", ""garlic"", ""salt"", ""baking powder"")","c(""Mix flour, salt and baking powder in a medium bowl, set aside."", ""In another bowl dissolve yeast in luke warm water then add 1 cup of the flour mixture."", ""Mix thoroughly."", ""Cover with a cloth and let rise 1 hour."", ""Meanwhile, dissolve the white sugar in the boiling water."", ""Stir well then let cool to luke warm."", ""Pour into the yeast mixture, then add the rest of the prepared flour mixture."", ""Stir to blend well."", ""Grease a large bowl."", ""Turn dough out onto a floured board and knead for 3 minutes-you want your dough smooth, not sticky."", 
""Place ball into bowl, turn once and cover with a damp cloth."", ""Let rise 2 hours or until doubled."", ""Meanwhile saute the garlic and onions in a small amount of oil in a wok."", ""Add meat and stir fry for 1 minute or until meat is no longer pink."", ""Add soy sauce, oyster sauce and brown sugar."", ""Pour in the dissolved cornstarch and stir fry quickly until meat is glazed well."", ""Remove from heat and let cool."", ""Punch down dough and knead on a floured board for 3 to 5 minutes."", ""Divide dough and roll each half into a 12x2 inch log."", 
""Cut each into 12 pieces, making 24."", ""Roll each piece into a ball using your hands then rolling it flat into a 3 inch diameter circle."", ""Dust with flour if needed to prevent sticking."", ""If using, place 1 slice of egg into center of dough round, then 1 T."", ""of filling with sauce."", ""Gather sides of round, pinch together and twist."", ""Place pinched side down on parchment paper and place in steamer."", ""Repeat until done."", ""Cover with a damp cloth and let rise for 1 hour."", ""Steam Siopao for 20 minutes."", 
""You can freeze cooked Siopao, simply re-steam for 10 minutes."")",216.2
Baked Lumpia Rolls,PT35M,Pork,"c(""Meat"", ""Filipino"", ""Asian"", ""< 60 Mins"", ""For Large Groups"", ""Oven"")","c(""carrot"", ""onion"", ""water chestnuts"", ""bamboo shoots"", ""garlic cloves"", ""fresh ginger"", ""soy sauce"", ""black pepper"", ""wonton wrapper"", ""egg"", ""brown sugar"", ""distilled white vinegar"", ""soy sauce"", ""water"", ""cornstarch"", ""ginger"")","c(""In a large bowl combine the pork, carrot, onion, water chestnut, bamboo shoots, garlic, ginger, soy sauce and pepper."", ""Stir mixture until thoroughly combined-at this point you can cover and stick in the fridge over night."", ""I lay out about 10 wrappers at a time, roll the meat mixture into cigar shapes about finger thickness-be reasonable-and the length of the wrapper."", ""Roll, brush ends with beaten egg and finish the roll to seal."", ""Place seam side down on a cookie sheet and repeat until done."", 
""Bake in a preheated 450 degree oven, turning once for around 20 minutes."", ""They should be cooked through and the wrappers are golden brown."", ""Serve hot."", ""You can make these ahead of time and keep cooked lumpia in the fridge for up to 3 days, or frozen up to 4 weeks."", ""To reheat (thaw if frozen) bake on baking sheet in a 450 oven for 10 minutes-turn rolls once."", ""Dipping sauce----------------."", ""In a 3 quart saucepan mix together the brown sugar, vinegar and soy sauce."", ""Stir over high heat until sugar dissolves."", 
""Mix the cornstarch/water and add to the sugar mixture and stir until mixture boils."", ""Remove from heat and stir in ginger."", ""Makes 2/3 cup and you can double."")",128.2
Escabeche with Papaya,PT50M,Lunch/Snacks,"c(""Papaya"", ""Potato"", ""Tropical Fruits"", ""Fruit"", ""Vegetable"", ""Filipino"", ""Asian"", ""< 60 Mins"")","c(""papayas"", ""onion"", ""garlic"", ""ginger"", ""vinegar"", ""water"", ""soy sauce"", ""flour"", ""sugar"", ""salt"")","c(""Clean fish and sprinkle with salt."", ""Let stand about 15 minutes and drain well."", ""Fry in hot oil until brown and set aside."", ""Saute garlic,ginger,onion and papaya until papaya is half cooked."", ""Add salt and hot pepper and mixture of vinegar,water,sugar,soy sauce and flour."", ""Cook until liquid thickens and the papaya becomes tender."", ""Place fried fish on a platter and pour over it the gravy mixture."", ""Garnish with sliced red-sweet pepper."")",210.3
Vegetarian Lumpia from the Philippines,PT1H25M,Vegetable,"c(""Filipino"", ""Asian"", ""Vegan"", ""Weeknight"", ""Oven"", ""< 4 Hours"")","c(""lumpia skins"", ""carrots"", ""leeks"", ""shallots"", ""onions"", ""salt"", ""plum sauce"")","c(""Saute chopped carrots, leeks, shallots and salt in sesame oil til the carrots are tender and soft."", ""Use the lumpia skins at either full size or 1/4 size (by cutting larger skins into four squares)."", ""Moisten a lumpia skin in water and roll the vegetable mixture into the skin."", ""Repeat with the remaining skins."", ""Bake at 375 on a lightly oiled baking sheet for approx 20-25 minutes or until lightly browned- keep an eye on them, as ovens vary."", ""Serve hot with plum or duck sauce."", ""Enjoy!""
)",110.7
Pancit Canton,PT50M,Chicken Breast,"c(""Chicken"", ""Pork"", ""Poultry"", ""Meat"", ""Filipino"", ""Asian"", ""< 60 Mins"", ""Stove Top"")","c(""onion"", ""garlic"", ""chicken breast"", ""shrimp"", ""soy sauce"", ""chicken broth"", ""cabbage"", ""green beans"", ""carrots"", ""shiitake mushroom"", ""black pepper"", ""green onions"", ""lemons"")","c(""If using mushrooms, soak them in warm water for 30 minutes, then cut into strips, discarding the tough stems."", ""Set aside."", ""Heat oil over medium-high heat in wok or large skillet."", ""Saute garlic and onions until tender."", ""Add pork, chicken and shrimp, and cook until browned."", ""Add soy sauce, stirring to flavor."", ""Add chicken broth and bring to boil."", ""Add cabbage, green beans, carrots and mushrooms."", ""Cook until vegetables are tender, yet crisp, 5-8 minutes."", ""Add noodles, mixing gently to prevent them from breaking."", 
""Cook until liquid is absorbed and noodles are done, about 10 minutes."", ""Remove from heat."", ""Season with black pepper and patis."", ""Garnish with green onions and lemon wedges."")",354.1
Chicken Pork Adobo (Philippines),PT2H,Pork,"c(""Meat"", ""Filipino"", ""Asian"", ""Weeknight"", ""Stove Top"", ""< 4 Hours"")","c(""garlic"", ""vinegar"", ""soy sauce"", ""Worcestershire sauce"", ""water"", ""chicken"", ""pork"", ""salt"", ""peppercorn"", ""brown sugar"")","c(""mix all the spices and water."", ""(including salt, pepper corn, etc.)."", ""Marinate the chicken and pork in the mixture for about an hour."", ""Bring to a boil then simmer until meat is tender."")",247.6
Flavor-Infused Chicken Adobo,PT1H25M,Stew,"c(""Lunch/Snacks"", ""Chicken"", ""Poultry"", ""Grains"", ""Beans"", ""Meat"", ""Filipino"", ""Asian"", ""Very Low Carbs"", ""Potluck"", ""Spicy"", ""Weeknight"", ""Stove Top"", ""< 4 Hours"", ""Easy"", ""Inexpensive"")","c(""chicken thighs"", ""white vinegar"", ""low sodium soy sauce"", ""peppercorn"", ""brown sugar"", ""garlic cloves"", ""bay leaves"", ""salt"")","c(""Combine all ingredients in a pan, cover, and marinate for one to three hours."", ""Bring to a boil, then lower heat and simmer for 30 minutes."", ""Uncover the pan and allow to simmer for an additional 15 minutes or until most of the liquid has evaporated and the chicken is lightly brown."", ""Serve with white rice."")",774.8
Easy to make Yema,PT15M,Dessert,"c(""Filipino"", ""Asian"", ""Healthy"", ""< 15 Mins"", ""For Large Groups"", ""Stove Top"")","c(""mashed potatoes"", ""vanilla"", ""butter"", ""sugar"", ""water"", ""cream of tartar"")","c(""combine all the ingredients for the yema and cook until the mixture is thick."", ""set aside and cool."", ""roll into balls of about 1 inch in diameter."", ""Prepare the syrup: blend all the ingredients for the syrup."", ""Bring to a boil until syrup is caramel-colored."", ""insert a toothpick into the yema ball and dip into the syrup."", ""cool on greased baking pan."")",111.5
Cassava Cake,PT2H,Dessert,"c(""Filipino"", ""Asian"", ""Free Of..."", ""Weeknight"", ""Oven"", ""< 4 Hours"")","c(""cassava"", ""sweetened condensed milk"", ""evaporated milk"", ""coconut milk"", ""coconut cream"", ""sugar"", ""eggs"", ""coconut"")","c(""Preheat oven to 325° f."", ""In large mixing bowl combine cake ingredients."", ""Mix well."", ""Pour equally into two large greased rectangular pans."", ""Bake until top is no longer liquid (approximately 30 minutes)."", ""Mix topping ingredients well and spread evenly on the two cakes."", ""Bake an additional 20 to 30 minutes."", ""Cool cakes completely."", ""Slice each cake into 24 equal squares."")",282.7
Humba (Braised Pork Belly),PT26H,Pork,"c(""Meat"", ""Filipino"", ""Asian"", ""Weeknight"", ""Stove Top"")","c(""bay leaves"", ""vinegar"", ""soy sauce"", ""fresh ground black pepper"", ""raw peanuts"", ""brown sugar"", ""garlic"")","c(""Parboil whole pork belly in about a liter of water for 10 minutes, then cut into 5 equal portions."", ""Reserve broth."", ""With a sharp knife, carefully score skin side of each portion making criss-cross slits, approximately 1 cm apart and 0.5 cm deep, then place in a bowl with all the remaining ingredients and marinate in the refrigerator overnight."", ""The next morning, bring the reserved broth to boil, add pork with remaining ingredients, and cook for 1 1/2 hours, until meat is tender."")",163.8
Easy Filipino Pancit Noodles for Two,PT30M,One Dish Meal,"c(""Pork"", ""Vegetable"", ""Meat"", ""Filipino"", ""Asian"", ""Healthy"", ""< 30 Mins"", ""Beginner Cook"", ""Stir Fry"", ""Easy"", ""Inexpensive"")","c(""boneless pork chops"", ""yellow onion"", ""fresh ground black pepper"", ""low sodium soy sauce"", ""green cabbage"", ""paprika"", ""hard-boiled egg"", ""green onions"")","c(""Heat a large skillet over medium heat and use either cooking spray or a small amount of oil; add the onions and pork and saute 5 minutes, or until browned, stirring often; remove pork from pan and set aside."", ""Soak rice noodles in warm water for 5 minutes then drain."", ""Heat pan over medium high heat; add noodles to pan and saute 2 minutes; stir in soy sauce, and cook 2 minutes more, tossing to coat."", ""Add cabbage and paprika (or cayenne) and cook 1 minute; then place pork back in pan and cook for 4 minutes more, stirring frequently."", 
""Garnish with egg slices and chopped green onion before serving."")",457.7
Filipino Style Fruit Salad,PT15M,Dessert,"c(""Pineapple"", ""Tropical Fruits"", ""Fruit"", ""Filipino"", ""Asian"", ""Kid Friendly"", ""< 15 Mins"", ""No Cook"", ""Refrigerator"", ""Easy"")","c(""heavy cream"", ""cream cheese"", ""pineapple chunks"", ""lychees"", ""coconut"", ""apples"")","c(""Mix heavy cream and cream cheese together to a smooth sauce like consistency."", ""Combine with other ingredients and blend well, chill overnight."")",625.9
